Disease,Overview,Symptoms,Causes,Prevention,Diagnosis,Treatment,Preparing_for_your_appointment,Keywords
Acute lymphocytic leukemia,"Acute lymphocytic leukemia (ALL) is a type of cancer of the blood and bone marrow — the spongy tissue inside bones where blood cells are made.
The word ""acute"" in acute lymphocytic leukemia comes from the fact that the disease progresses rapidly and creates immature blood cells, rather than mature ones. The word ""lymphocytic"" in acute lymphocytic leukemia refers to the white blood cells called lymphocytes, whichALLaffects. Acute lymphocytic leukemia is also known as acute lymphoblastic leukemia.
Acute lymphocytic leukemia is the most common type of cancer in children, and treatments result in a good chance for a cure. Acute lymphocytic leukemia can also occur in adults, though the chance of a cure is greatly reduced.","Signs and symptoms of acute lymphocytic leukemia may include:
Bleeding from the gums
Bone pain
Fever
Frequent infections
Frequent or severe nosebleeds
Lumps caused by swollen lymph nodes in and around the neck, armpits, abdomen or groin
Pale skin
Shortness of breath
Weakness, fatigue or a general decrease in energy","Acute lymphocytic leukemia occurs when a bone marrow cell develops changes (mutations) in its genetic material or DNA. A cell's DNA contains the instructions that tell a cell what to do. Normally, the DNA tells the cell to grow at a set rate and to die at a set time. In acute lymphocytic leukemia, the mutations tell the bone marrow cell to continue growing and dividing.
When this happens, blood cell production becomes out of control. The bone marrow produces immature cells that develop into leukemic white blood cells called lymphoblasts. These abnormal cells are unable to function properly, and they can build up and crowd out healthy cells.
It's not clear what causes the DNA mutations that can lead to acute lymphocytic leukemia.",,"Tests and procedures used to diagnose acute lymphocytic leukemia include:
Blood tests.Blood tests may reveal too many or too few white blood cells, not enough red blood cells, and not enough platelets. A blood test may also show the presence of blast cells — immature cells normally found in the bone marrow.
Bone marrow test.During bone marrow aspiration and biopsy, a needle is used to remove a sample of bone marrow from the hipbone or breastbone. The sample is sent to a lab for testing to look for leukemia cells.Doctors in the lab will classify blood cells into specific types based on their size, shape, and other genetic or molecular features. They also look for certain changes in the cancer cells and determine whether the leukemia cells began from B lymphocytes or T lymphocytes. This information helps your doctor develop a treatment plan.
Imaging tests.Imaging tests such as an X-ray, a computerized tomography (CT) scan or an ultrasound scan may help determine whether cancer has spread to the brain and spinal cord or other parts of the body.
Spinal fluid test.A lumbar puncture test, also called a spinal tap, may be used to collect a sample of spinal fluid — the fluid that surrounds the brain and spinal cord. The sample is tested to see whether cancer cells have spread to the spinal fluid.","In general, treatment for acute lymphocytic leukemia falls into separate phases:
Induction therapy.The purpose of the first phase of treatment is to kill most of the leukemia cells in the blood and bone marrow and to restore normal blood cell production.
Consolidation therapy.Also called post-remission therapy, this phase of treatment is aimed at destroying any remaining leukemia in the body.
Maintenance therapy.The third phase of treatment prevents leukemia cells from regrowing. The treatments used in this stage are usually given at much lower doses over a long period of time, often years.
Preventive treatment to the spinal cord.During each phase of therapy, people with acute lymphocytic leukemia may receive additional treatment to kill leukemia cells located in the central nervous system. In this type of treatment, chemotherapy drugs are often injected directly into the fluid that covers the spinal cord.
Depending on your situation, the phases of treatment for acute lymphocytic leukemia can span two to three years.
Treatments may include:
Chemotherapy.Chemotherapy, which uses drugs to kill cancer cells, is typically used as an induction therapy for children and adults with acute lymphocytic leukemia. Chemotherapy drugs can also be used in the consolidation and maintenance phases.
Targeted therapy.Targeted drug treatments focus on specific abnormalities present within cancer cells. By blocking these abnormalities, targeted drug treatments can cause cancer cells to die. Your leukemia cells will be tested to see if targeted therapy may be helpful for you. Targeted therapy can be used alone or in combination with chemotherapy for induction therapy, consolidation therapy or maintenance therapy.
Radiation therapy.Radiation therapy uses high-powered beams, such as X-rays or protons, to kill cancer cells. If the cancer cells have spread to the central nervous system, your doctor may recommend radiation therapy.
Bone marrow transplant.A bone marrow transplant, also known as a stem cell transplant, may be used as consolidation therapy or for treating relapse if it occurs. This procedure allows someone with leukemia to reestablish healthy bone marrow by replacing leukemic bone marrow with leukemia-free marrow from a healthy person.A bone marrow transplant begins with high doses of chemotherapy or radiation to destroy any leukemia-producing bone marrow. The marrow is then replaced by bone marrow from a compatible donor (allogeneic transplant).
Engineering immune cells to fight leukemia.A specialized treatment called chimeric antigen receptor (CAR)-T cell therapy takes your body's germ-fighting T cells, engineers them to fight cancer and infuses them back into your body.CAR-T cell therapy might be an option for children and young adults. It might be used for consolidation therapy or for treating relapse.
Clinical trials.Clinical trials are experiments to test new cancer treatments and new ways of using existing treatments. While clinical trials give you or your child a chance to try the latest cancer treatment, the benefits and risks of the treatment may be uncertain. Discuss the benefits and risks of clinical trials with your doctor.","Make an appointment with your family doctor if you or your child has signs and symptoms that worry you. If your doctor suspects acute lymphocytic leukemia, you'll likely be referred to a doctor who specializes in treating diseases and conditions of the blood and bone marrow (hematologist).
Because appointments can be brief, and because there's often a lot of information to discuss, it's a good idea to be prepared. Here's some information to help you get ready, and what to expect from the doctor.","pain, frequent infections, fatigue, weakness, nosebleeds, fever, frequent or severe nosebleeds, acute lymphocytic leukemia, infections, pale skin, bone pain, bleeding from the gums, shortness of breath, shortness of breath
weakness, lumps"
Radiation sickness,"Radiation sickness is damage to the body caused by a large dose of radiation often received over a short time. This is called acute radiation sickness. The amount of radiation absorbed by the body, called the absorbed dose, determines how bad the illness will be.
Radiation sickness also is called acute radiation syndrome or radiation poisoning. Radiation sickness is not caused by common medical imaging tests that use low-dose radiation, such as X-rays, CT scans and nuclear medicine scans.
Although radiation sickness is serious and often fatal, it's rare. Since the atomic bombings of Hiroshima and Nagasaki, Japan, during World War II, most cases of radiation sickness have occurred after nuclear industrial accidents, such as the 1986 fire that damaged the nuclear power plant at Chernobyl, Ukraine.","The severity of radiation sickness symptoms depends on how much radiation you've absorbed. How much you absorb depends on the strength of the radiated energy, the time of your exposures, and the distance between you and the source of radiation.
Symptoms also are affected by the type of exposure, such as total or partial body. The severity of radiation sickness also depends on how sensitive the affected tissue is. For instance, the gastrointestinal system and bone marrow are highly sensitive to radiation.","Radiation sickness is caused by being exposed to a high dose of radiation. Radiation is the energy released from atoms as either a wave or a tiny particle of matter.
Radiation sickness happens when high-energy radiation damages or destroys certain cells in the body. Areas of the body most at risk of being affected by high-energy radiation are the bone marrow cells and the lining of the intestinal tract.","In the event of a radiation emergency, listen to the radio or watch television to hear what protective actions local, state and federal authorities recommend. Those actions depend on the situation, but you will be told to either stay in place or evacuate your area.","When a person has experienced known or probable exposure to a high dose of radiation from an accident or attack, medical personnel take a number of steps to determine the absorbed radiation dose. This information is essential for determining how serious the illness is likely to be, which treatments to use and whether a person is likely to survive.
Information important for determining an absorbed dose includes:
Known exposure.Details about distance from the source of radiation and duration of exposure can help provide a rough estimate of the severity of radiation sickness.
Vomiting and other symptoms.The time between radiation exposure and when vomiting starts is a fairly accurate screening tool to estimate absorbed radiation dose. The shorter the time before vomiting starts, the higher the dose. The severity and timing of other symptoms also may help medical personnel determine the absorbed dose.
Blood tests.Frequent blood tests over several days enable medical personnel to look for drops in disease-fighting white blood cells and unusual changes in the DNA of blood cells. These factors indicate the degree of bone marrow damage, which is determined by the level of an absorbed dose.
Dosimeter.A device called a dosimeter can measure the absorbed dose of radiation but only if it was exposed to the same radiation event as the affected person.
Survey meter.A device such as a Geiger counter can be used to test people to see where in the body radioactive particles are located.
Type of radiation.A part of the larger emergency response to a radioactive accident or attack would include identifying the type of radiation exposure. This information would guide some decisions for treating people with radiation sickness.","The treatment goals for radiation sickness are to prevent further radioactive contamination; treat life-threatening injuries, such as from burns and trauma; reduce symptoms; and manage pain.",,"exposures, radiation sickness"
ARDS,"Acute respiratory distress syndrome (ARDS) occurs when lung swelling causes fluid to build up in the tiny elastic air sacs in the lungs. These air sacs, called alveoli, have a protective membrane, but lung swelling damages that membrane. The fluid leaking into the air sacs keeps the lungs from filling with enough air. This means less oxygen reaches the bloodstream, so the body's organs don't get the oxygen they need to work properly.
ARDS usually occurs in people who are already critically ill or have major injuries. People usually are severely short of breath — the main symptom of ARDS — within a few hours to a few days after the injury or infection that caused ARDS.
Many people who get ARDS don't survive. The risk of death gets higher with age and how severe the illness is. Of the people who survive ARDS, some fully recover. But others have lasting lung damage.","The seriousness of ARDS symptoms can vary depending on what's causing them and whether there is underlying heart or lung disease. Symptoms include:
Severe shortness of breath.
Labored and rapid breathing that is not usual.
Cough.
Chest discomfort.
Fast heart rate.
Confusion and extreme tiredness.","Causes of ARDS include:
Sepsis.The most common cause of ARDS is sepsis, a serious and widespread infection of the bloodstream.
Severe pneumonia.Severe cases of pneumonia usually affect all five lobes of the lungs.
Coronavirus disease 2019 (COVID-19).People who have severe COVID-19 may get ARDS. Because COVID-19 mainly affects the respiratory system, it can cause lung injury and swelling that can lead to COVID-19-related ARDS.
Head, chest or other major injury.Accidents, such as falls or car crashes, can damage the lungs or the portion of the brain that controls breathing.
Breathing in harmful substances.Breathing in a lot of smoke or chemical fumes can lead to ARDS, as can breathing in vomit. Breathing in water in cases of near-drownings also can cause ARDS.
Other conditions and treatments.Swelling of the pancreas (pancreatitis), massive blood transfusions and severe burns can lead to ARDS.",,"There's no specific test for ARDS. Healthcare professionals base the diagnosis on physical exams, chest X-rays and oxygen levels. It's also important to rule out other diseases and conditions, such as certain heart problems that can lead to similar symptoms.","The first goal in treating ARDS is to improve the levels of oxygen in your blood. Without oxygen, your organs can't work properly.",,"tiredness, rapid breathing, labored, labored breathing, chest discomfort, fast heart rate, extreme tiredness, confusion, ards, cough, shortness of breath"
Acute sinusitis,"Acute sinusitis causes the spaces inside the nose, known as sinuses, to become inflamed and swollen. Acute sinusitis makes it hard for the sinuses to drain. Mucus builds up.
Acute sinusitis can make it hard to breathe through the nose. The area around the eyes and the face might feel swollen. There might be throbbing face pain or a headache.
The common cold is the usual cause of acute sinusitis. Most often, the condition clears up within a week to 10 days unless there's also an infection caused by bacteria, called a bacterial infection. Home remedies might be all that's needed to treat acute sinusitis. Sinusitis that lasts more than 12 weeks even with medical treatment is called chronic sinusitis.","Acute sinusitis symptoms often include:
Thick, yellow or greenish mucus from the nose, known as a runny nose, or down the back of the throat, known as postnasal drip.
Blocked or stuffy nose, known as congestion. This makes it hard to breathe through the nose.
Pain, tenderness, swelling and pressure around the eyes, cheeks, nose or forehead that gets worse when bending over.
Other signs and symptoms include:
Ear pressure.
Headache.
Aching in the teeth.
Changed sense of smell.
Cough.
Bad breath.
Tiredness.
Fever.","Acute sinusitis is an infection caused by a virus. The common cold is most often the cause. Sometimes, sinuses that are blocked for a time might get a bacterial infection.","Take these steps to help lower your risk of getting acute sinusitis:
Stay well.Try to stay away from people who have colds or other infections. Wash your hands often with soap and water, such as before meals.
Manage allergies.Work with your health care provider to keep symptoms under control.
Avoid cigarette smoke and polluted air.Tobacco smoke and other pollutants can irritate lungs and inside the nose, known as nasal passages.
Use a machine that adds moisture to the air, known as a humidifier.If the air in your home is dry, adding moisture to the air may help prevent sinusitis. Be sure the humidifier stays clean and free of mold with regular, complete cleaning.","A health care provider might ask about symptoms and do an exam. The exam might include feeling for tenderness in the nose and face and looking inside the nose.
Other ways to diagnose acute sinusitis and rule out other conditions include:
Nasal endoscopy.A health care provider inserts a thin, flexible tube, known as an endoscope, into the nose. A light on the tube allows the provider to see inside the sinuses.
Imaging studies.A CT scan can show details of the sinuses and nasal area. It's not usually used for simple acute sinusitis. But imaging studies might help rule out other causes.
Nasal and sinus samples.Lab tests aren't often used to diagnose acute sinusitis. But if the condition doesn't get better with treatment or gets worse, tissue samples from the nose or sinuses might help find the cause.",Most cases of acute sinusitis get better on their own. Self-care is usually all that's needed to ease symptoms.,Here's information to help you get ready for your appointment.,"pain, cough, throat, headache, postnasal, swelling, tiredness, congestion, pressure, fever, ear pressure, aching, postnasal drip, acute sinusitis symptoms, bad breath, tenderness, runny nose, changed sense of smell"
Autoimmune epilepsy,"Autoimmune epilepsy is a type of epilepsy where seizures are caused by the immune system mistakenly attacking brain cells. It can occur with conditions that affect the immune system, especially autoimmune encephalitis.
Autoimmune epilepsy also is known as autoimmune associated epilepsy and acute symptomatic seizures secondary to autoimmune encephalitis.
The immune system protects the body from viruses, bacteria and other substances that can cause illnesses. Antibodies are proteins that are part of the immune system. In autoimmune epilepsy, antibodies mistakenly target receptors in the brain. This leads to swelling in the brain, also known as inflammation, and seizures.
Antiseizure medicines usually don't do enough to manage seizures in people with autoimmune epilepsy. Instead, immunotherapy medicines help reduce the immune response on the brain.
When immunotherapy is started early, it can reduce inflammation and improve seizures. For some people, treatment can stop seizures completely. For others, seizures may continue after treatment.","Symptoms of autoimmune epilepsy may begin after an illness with a fever. Seizures come on suddenly and are serious. The types of seizures that may occur include:
Focal seizures.These are the most common type of seizure in autoimmune epilepsy. Sometimes focal seizures cause a change or loss of awareness. The seizures may cause the person to stare and not respond to the environment. Other types of focal seizures don't cause a change in awareness. These seizures cause different symptoms depending on which part of the brain causes them. Focal seizures may cause one part of the body to shake. Or they may cause a feeling that his has happened before, known as déjà vu. Focal seizures also may cause nausea or vision symptoms, such as flashing lights.
Faciobrachial dystonic seizures.These seizures cause muscle contractions on one side of the face and in an arm, both on the same side of the body.
Symptoms related to seizures include:
Seizures that happen several times a day.
Seizures that don't go away with antiseizure medicines.
Seizures that last more than five minutes or that occur close together without the person regaining consciousness, known as status epilepticus.
Autoimmune epilepsy symptoms also may include:
Memory loss and trouble with thinking.
Personality and behavior changes.
Involuntary movements or clumsy movements.
Irregular eye movements.
Changes in heart rate, blood pressure and other automatic functions.","Autoimmune epilepsy is caused by the immune system attacking brain cells and leading to seizures. Antibodies are part of the immune system. They usually protect the body from viruses and infections. But in autoimmune conditions, the immune system attacks healthy cells. More recently, research has concluded that epilepsy can be an autoimmune disease.
Autoimmune epilepsy causes may include:
Autoimmune encephalitis.Autoimmune encephalitis (en-sef-uh-LIE-tis) is a group of conditions that causes swelling in the brain. This happens because the immune system mistakenly attacks brain cells. Autoimmune encephalitis causes a variety of symptoms, including seizures. It is the most common cause of autoimmune epilepsy. Certain types of autoimmune encephalitis are commonly linked to autoimmune epilepsy and are associated with antibodies that target NMDA-receptors, LGI1, CASPR2 and GAD65.
Rasmussen syndrome.In this condition, immune cells known as T cells cause inflammation and brain damage that lead to seizures. People with autoimmune epilepsy due to Rasmussen syndrome may continue to have seizures after treatment.
Cancer.Sometimes tumors trigger the immune system to attack healthy brain cells, known as paraneoplastic syndrome. This can lead to epilepsy.","You may not be able to prevent autoimmune epilepsy. But getting cancer screenings can help your healthcare professional find tumors and treat them early. This could prevent autoimmune encephalitis triggered by cancers, which can be a cause of epilepsy. Talk with your healthcare professional about your cancer risk and if you should get screened for certain cancers.","An autoimmune epilepsy diagnosis begins with a physical exam and a review of your symptoms.
Testings for autoimmune epilepsy includes lab tests, brain imaging and testing the electrical activity in the brain.","Autoimmune epilepsy treatment differs from the treatment used for other types of epilepsy. Healthcare professionals use immunotherapy to reduce the immune system activity and treat seizures.
If cancer is the cause of autoimmune epilepsy, treating the cancer is an important part of treatment.","If your symptoms are serious, you might need emergency medical care.
If your symptoms are less serious, you may start by seeing your healthcare professional. Or you may be referred right away to a doctor who specializes in nervous system conditions, known as a neurologist.","nausea, autoimmune epilepsy symptoms, involuntary movements, autoimmune epilepsy, seizure, memory loss, stare, Here are the extracted medical symptoms:

fever, muscle contractions, status epilepticus, vision symptoms, clumsy movements, faciobrachial dystonic seizures, nausea or vision symptoms, antiseizure, blood pressure, seizures, behavior changes, shaking, trouble with thinking, loss of awareness, personality changes, fever, irregular eye movements, flashing lights, changes in heart rate"
