Disease,Overview,Symptoms,Causes,Prevention,Diagnosis,Treatment,Preparing_for_your_appointment,Keywords
Alcohol use disorder,"Alcohol use disorder is a pattern of alcohol use that involves problems controlling your drinking, being preoccupied with alcohol or continuing to use alcohol even when it causes problems. This disorder also involves having to drink more to get the same effect or having withdrawal symptoms when you rapidly decrease or stop drinking. Alcohol use disorder includes a level of drinking that's sometimes called alcoholism.
Unhealthy alcohol use includes any alcohol use that puts your health or safety at risk or causes other alcohol-related problems. It also includes binge drinking — a pattern of drinking where a male has five or more drinks within two hours or a female has at least four drinks within two hours. Binge drinking causes significant health and safety risks.
If your pattern of drinking results in repeated significant distress and problems functioning in your daily life, you likely have alcohol use disorder. It can range from mild to severe. However, even a mild disorder can escalate and lead to serious problems, so early treatment is important.","Alcohol use disorder can be mild, moderate or severe, based on the number of symptoms you experience. Signs and symptoms may include:
Being unable to limit the amount of alcohol you drink
Wanting to cut down on how much you drink or making unsuccessful attempts to do so
Spending a lot of time drinking, getting alcohol or recovering from alcohol use
Feeling a strong craving or urge to drink alcohol
Failing to fulfill major obligations at work, school or home due to repeated alcohol use
Continuing to drink alcohol even though you know it's causing physical, social, work or relationship problems
Giving up or reducing social and work activities and hobbies to use alcohol
Using alcohol in situations where it's not safe, such as when driving or swimming
Developing a tolerance to alcohol so you need more to feel its effect or you have a reduced effect from the same amount
Experiencing withdrawal symptoms — such as nausea, sweating and shaking — when you don't drink, or drinking to avoid these symptoms
Alcohol use disorder can include periods of being drunk (alcohol intoxication) and symptoms of withdrawal.
Alcohol intoxicationresults as the amount of alcohol in your bloodstream increases. The higher the blood alcohol concentration is, the more likely you are to have bad effects. Alcohol intoxication causes behavior problems and mental changes. These may include inappropriate behavior, unstable moods, poor judgment, slurred speech, problems with attention or memory, and poor coordination. You can also have periods called ""blackouts,"" where you don't remember events. Very high blood alcohol levels can lead to coma, permanent brain damage or even death.
Alcohol withdrawalcan occur when alcohol use has been heavy and prolonged and is then stopped or greatly reduced. It can occur within several hours to 4 to 5 days later. Signs and symptoms include sweating, rapid heartbeat, hand tremors, problems sleeping, nausea and vomiting, hallucinations, restlessness and agitation, anxiety, and occasionally seizures. Symptoms can be severe enough to impair your ability to function at work or in social situations.","Genetic, psychological, social and environmental factors can impact how drinking alcohol affects your body and behavior. Theories suggest that for certain people drinking has a different and stronger impact that can lead to alcohol use disorder.
Over time, drinking too much alcohol may change the normal function of the areas of your brain associated with the experience of pleasure, judgment and the ability to exercise control over your behavior. This may result in craving alcohol to try to restore good feelings or reduce negative ones.","Early intervention can prevent alcohol-related problems in teens. If you have a teenager, be alert to signs and symptoms that may indicate a problem with alcohol:
Loss of interest in activities and hobbies and in personal appearance
Red eyes, slurred speech, problems with coordination and memory lapses
Difficulties or changes in relationships with friends, such as joining a new crowd
Declining grades and problems in school
Frequent mood changes and defensive behavior
You can help prevent teenage alcohol use:
Set a good example with your own alcohol use.
Talk openly with your child, spend quality time together and become actively involved in your child's life.
Let your child know what behavior you expect — and what the consequences will be for not following the rules.","You're likely to start by seeing your primary health care provider. If your provider suspects that you have a problem with alcohol, you may be referred to a mental health provider.
To assess your problem with alcohol, your provider will likely:
Ask you some questions related to your drinking habits.The provider may ask for permission to speak with family members or friends. However, confidentiality laws prevent your provider from giving out any information about you without your consent.
Perform a physical exam.Your health care provider may do a physical exam and ask questions about your health. There are many physical signs that indicate complications of alcohol use.
Suggest lab tests and imaging tests.While there are no specific tests to diagnose alcohol use disorder, certain patterns of lab test results may strongly suggest it. And you may need tests to identify health problems that may be linked to your alcohol use. Damage to your organs may be seen on tests.
Complete a psychological evaluation.This evaluation includes questions about your symptoms, thoughts, feelings and behavior patterns. You may be asked to complete a questionnaire to help answer these questions.","Treatment for alcohol use disorder can vary, depending on your needs. Treatment may involve a brief intervention, individual or group counseling, an outpatient program, or a residential inpatient stay. Working to stop alcohol use to improve quality of life is the main treatment goal.
Treatment for alcohol use disorder may include:
Detox and withdrawal.Treatment may begin with a program of detoxification — withdrawal that's medically managed. Sometimes called detox, this generally takes 2 to 7 days. You may need to take sedating medications to prevent withdrawal symptoms. Detox is usually done at an inpatient treatment center or a hospital.
Learning new skills and making a treatment plan.This process usually involves alcohol treatment specialists. It may include goal setting, behavior change techniques, use of self-help manuals, counseling and follow-up care at a treatment center.
Psychological counseling.Counseling and therapy for groups and individuals help you better understand your problem with alcohol and support recovery from the psychological aspects of alcohol use. You may benefit from couples or family therapy — family support can be an important part of the recovery process.
Oral medications.A drug called disulfiram may help prevent you from drinking, although it won't cure alcohol use disorder or remove the urge to drink. If you drink alcohol while taking disulfiram, the drug produces a physical reaction that may include flushing, nausea, vomiting and headaches.Naltrexone, a drug that blocks the good feelings alcohol causes, may prevent heavy drinking and reduce the urge to drink. Acamprosate may help you combat alcohol cravings once you stop drinking. Unlike disulfiram, naltrexone and acamprosate don't make you feel sick after taking a drink.
Injected medication.Vivitrol, a version of the drug naltrexone, is injected once a month by a health care professional. Although similar medication can be taken in pill form, the injectable version of the drug may be easier for people recovering from alcohol use disorder to use consistently.
Continuing support.Aftercare programs and support groups help people recovering from alcohol use disorder to stop drinking, manage relapses and cope with necessary lifestyle changes. This may include medical or psychological care or attending a support group.
Treatment for psychological problems.Alcohol use disorder commonly occurs along with other mental health disorders. If you have depression, anxiety or another mental health condition, you may need talk therapy (psychotherapy), medications or other treatment.
Medical treatment for health conditions.Many alcohol-related health problems improve significantly once you stop drinking. But some health conditions may warrant continued treatment and follow-up care.
Spiritual practice.People who are involved with some type of regular spiritual practice may find it easier to maintain recovery from alcohol use disorder or other addictions. For many people, gaining greater insight into their spiritual side is a key element in recovery.","Here's some information to help you get ready for your appointment, and what to expect from your health care provider or mental health provider.
Consider your drinking habits. Take an honest look at how often and how much you drink. Be prepared to discuss any problems that alcohol may be causing. You may want to take a family member or friend along, if possible.
Before your appointment, make a list of:
Any symptoms you've had,including any that may seem unrelated to your drinking
Key personal information,including any major stresses or recent life changes
All medications,vitamins, herbs or other supplements that you're taking and their dosages
Questions to askyour provider
Some questions to ask include:
Do you think I drink too much or show signs of problem drinking?
Do you think I need to cut back or quit drinking?
Do you think alcohol could be causing or worsening my other health problems?
What's the best course of action?
What are the alternatives to the approach that you're suggesting?
Do I need any medical tests for underlying physical problems?
Are there any brochures or other printed material that I can have? What websites do you recommend?
Would it be helpful for me to meet with a professional experienced in alcohol treatment?
Don't hesitate to ask any other questions.","poor judgment, nausea, brain damage, restlessness, blackouts, disorder, problems sleeping, inappropriate behavior, unstable moods, nausea, sweating, anxiety, slurred speech, alcohol, death, sweating, hand tremors, agitation, vomiting, coma, rapid heartbeat, poor coordination, seizures, shaking, problems with attention or memory, alcohol intoxication, hallucinations, tremors"
